instruction_text,left_answer,right_answer,deontological_button,dilemma_name
"You are at the wheel of a runaway trolley quickly approaching a fork in the tracks. On the tracks extending to the left is a group of five railway workmen. On the tracks extending to the right is a single railway workman. If you do nothing the trolley will proceed to the left, causing the deaths of the five workmen. The only way to avoid the deaths of these workmen is to hit a switch on your dashboard that will cause the trolley to proceed to the right, causing the death of the single workman. 

Do you hit the switch?",No,Yes,left_button,"""Standard Trolley"""
"You are the late-night watchman in a hospital. Due to an accident in the building next door, there are deadly fumes rising up through the hospital’s ventilation system. In a certain room of the hospital are three patients. In another room there is a single patient. If you do nothing the fumes will rise up into the room containing the three patients and cause their deaths. The only way to avoid the deaths of these patients is to hit a certain switch, which will cause the fumes to bypass the room containing the three patients. As a result of doing this the fumes will enter the room containing the single patient, causing his death.

Do you hit the switch?",Yes,No,right_button,"""Standard Fumes"""
"You are a doctor. You have five patients, each of whom is about to die due to a failing organ of some kind. You have another patient who is healthy. The only way that you can save the lives of the first five patients is to transplant five of this young man’s organs (against his will) into the bodies of the other five patients. If you do this, the young man will die, but the other five patients will live.

Do you transplant his organs?",No,Yes,left_button,"""Transplant"""
"A runaway trolley is heading down the tracks toward five workmen who will be killed if the trolley proceeds on its present course. You are on a footbridge over the tracks, in between the approaching trolley and the five workmen. Next to you on this footbridge is a stranger who happens to be very large. The only way to save the lives of the five workmen is to push this stranger off the bridge and onto the tracks below where his large body will stop the trolley. The stranger will die if you do this, but the five workmen will be saved.

Do you push the stranger?",Yes,No,right_button,"""Footbridge"""
"Enemy soldiers have taken over your village. They have orders to kill all remaining civilians. You and some of your townspeople have sought refuge in the cellar of a large house. Outside you hear the voices of soldiers who have come to search the house for valuables. Your baby begins to cry loudly. You cover his mouth to block the sound. If you remove your hand from his mouth his crying will summon the attention of the soldiers who will kill you, your child, and the others hiding out in the cellar. Keeping your hand on the mouth will kill your baby however.

Do you keep your hand on your baby's mouth?
",No,Yes,left_button,"""Crying baby"""
"Your plane has crashed in the Himalayas. The only survivors are yourself, another man, and a young boy. The three of you travel for days, battling extreme cold and wind. Your only chance at survival is to find your way to small a village on the other side of the mountain, several days away. The boy has a broken leg and cannot move very quickly. His chances of surviving the journey are essentially zero. Without food,you and the other man will probably die as well. The other man suggests that you sacrifice the boy and eat his remains over the next few days.
",Yes,No,right_button,"""Plane Crash"""
"You are the leader of a mountaineering expedition that is stranded in the wilderness. Your expedition includes a family of six that has a genetically caused vitamin defi ciency. A few people’s kidneys contain large amounts of this vitamin. There is one such person in your party. The only way to save the lives of the six members of this family is to remove one of this man’s kidneys so that the necessary vitamins may be extracted from it. The man will not die if you do this, but his health will be compromised. The man is opposed to this plan, but you have the power to do as you see fit. 

Do you sacrifice the boy?",No,Yes,left_button,"""Vitamins"""
"You are negotiating with a powerful and determined terrorist who is about to set off a bomb in a crowded area. Your one advantage is that you have his teen-age son in your custody. There is only one thing that you can do to stop him from detonating his bomb, which will kill thousands of people if detonated. To stop him, you must contact him over the satellite hook-up that hehas established and, in front of the camera, break one of his son’s arms and then threaten to break the other one if he does not give himself up.

Do you break the son's arm?",Yes,No,right_button,"""Bomb 2"""